{
  "lesson_id": "LESSON-T1-GIR-ANALOGY-001",
  "title": "Analogies: Find the Relationship",
  "topic_id": "T1-GIR-ANALOGY",
  "target_cycle": 2027,
  "source_cycle": 2026,
  "mapping_status": "provisional_previous_cycle",
  "content_status": "draft",
  "estimated_minutes": 20,
  "learning_objectives": [
    "Identify the relationship between a pair of words or numbers.",
    "Apply the same relationship to a second pair.",
    "Explain why one option fits better than the alternatives."
  ],
  "sections": [
    {
      "heading": "What is an analogy?",
      "body": "An analogy asks you to recognize a relationship in one pair and apply the same relationship to another pair. Do not match words merely because they are associated; state the exact relationship first."
    },
    {
      "heading": "A four-step method",
      "body": "1. Read the first pair. 2. Say the relationship in a short sentence. 3. Apply that sentence to the second pair. 4. Check every option and eliminate choices that change the relationship."
    },
    {
      "heading": "Example",
      "body": "Bird : nest :: bee : hive. A bird may live in a nest, and a bee colony lives in a hive. The relation is animal-to-dwelling, so 'hive' completes the pair."
    },
    {
      "heading": "Avoid common traps",
      "body": "Avoid loose associations. If the first pair describes a tool and its function, the second pair should preserve that same direction and level of specificity. Check whether more than one option could reasonably fit."
    }
  ],
  "questions": [
    {
      "question_id": "ANALOGY-01",
      "prompt": "Bird : nest :: bee : ?",
      "options": [
        { "option_id": "A", "text": "web" },
        { "option_id": "B", "text": "hive" },
        { "option_id": "C", "text": "burrow" },
        { "option_id": "D", "text": "den" }
      ],
      "correct_option_id": "B",
      "explanation": "The relationship is an animal and its typical dwelling. A bee colony lives in a hive.",
      "review_status": "draft"
    },
    {
      "question_id": "ANALOGY-02",
      "prompt": "Book : read :: food : ?",
      "options": [
        { "option_id": "A", "text": "cook" },
        { "option_id": "B", "text": "buy" },
        { "option_id": "C", "text": "eat" },
        { "option_id": "D", "text": "serve" }
      ],
      "correct_option_id": "C",
      "explanation": "The first item is commonly acted on by the verb: people read a book and eat food.",
      "review_status": "draft"
    },
    {
      "question_id": "ANALOGY-03",
      "prompt": "3 : 9 :: 4 : ?",
      "options": [
        { "option_id": "A", "text": "8" },
        { "option_id": "B", "text": "12" },
        { "option_id": "C", "text": "16" },
        { "option_id": "D", "text": "20" }
      ],
      "correct_option_id": "C",
      "explanation": "The first number is squared: 3 × 3 = 9, so 4 × 4 = 16.",
      "review_status": "draft"
    },
    {
      "question_id": "ANALOGY-04",
      "prompt": "Hand : glove :: foot : ?",
      "options": [
        { "option_id": "A", "text": "sock" },
        { "option_id": "B", "text": "shoehorn" },
        { "option_id": "C", "text": "lace" },
        { "option_id": "D", "text": "sole" }
      ],
      "correct_option_id": "A",
      "explanation": "A glove is worn on a hand; a sock is worn on a foot. Shoes are also worn on feet, but among these options 'sock' best preserves the clothing-item relation and specificity.",
      "review_status": "draft"
    },
    {
      "question_id": "ANALOGY-05",
      "prompt": "Puppy : dog :: kitten : ?",
      "options": [
        { "option_id": "A", "text": "goat" },
        { "option_id": "B", "text": "cat" },
        { "option_id": "C", "text": "cub" },
        { "option_id": "D", "text": "puppy" }
      ],
      "correct_option_id": "B",
      "explanation": "A puppy is a young dog; a kitten is a young cat.",
      "review_status": "draft"
    }
  ],
  "flashcards": [
    { "front": "What is the first step in solving a word analogy?", "back": "State the exact relationship in the first pair in a short sentence." },
    { "front": "What should you check after choosing an analogy answer?", "back": "Verify that the same relationship and direction apply to both pairs." },
    { "front": "What is a number analogy?", "back": "A pair of numbers connected by a rule, such as squaring or doubling." },
    { "front": "How do you avoid loose associations?", "back": "Prefer the most precise relationship that fits the original pair and test it against every option." }
  ],
  "sources": [
    {
      "source_id": "SSC-CGL-2026-NOTICE",
      "url": "https://ssc.gov.in/api/attachment/uploads/masterData/NoticeBoards/Notice_of_adv_cgl_2026.pdf",
      "description": "Official 2026 notice, §13.10.1, printed PDF page 30. Supports topic scope for 2026 only; 2027 mapping remains provisional."
    }
  ],
  "review": {
    "reviewer": null,
    "reviewed_at": null,
    "outcome": "not_started",
    "notes": "Draft for Role 06 independent academic review. Confirm source and mapping against the applicable 2027 notice before approval; independently check all question ambiguity and answers."
  }
}
